Factor,Sentence
Interest Rates,Interest rate increases typically lead to a stronger national currency.
Interest Rates,Higher interest rates generally boost a country’s currency value.
Interest Rates,Currencies often gain strength when central banks raise interest rates.
Inflation Rates,High inflation tends to erode the value of a country’s currency over time.
Inflation Rates,Elevated inflation levels can cause a decline in currency strength.
Inflation Rates,Persistent inflation weakens a currency’s purchasing power.
Balance of Payments,A trade surplus often contributes to long-term currency appreciation.
Balance of Payments,Export surpluses can support the appreciation of a national currency.
Balance of Payments,A country with a positive current account balance may see its currency rise.
GDP Growth,Rapid economic growth can attract foreign investment and strengthen the currency.
GDP Growth,Strong GDP figures usually lead to a rise in foreign exchange value.
GDP Growth,Economic expansion tends to make a currency more attractive to investors.
Political Stability,Political uncertainty often causes volatility in the foreign exchange market.
Political Stability,Instability in government often triggers currency market fluctuations.
Political Stability,Stable political conditions reduce volatility in the exchange rate.
Government Debt,Rising public debt may weaken investor confidence in a country's currency.
Government Debt,Large national debts may deter investors and depreciate the currency.
Government Debt,High government borrowing can raise concerns about currency stability.
Market Sentiment,Currency values are frequently influenced by trader sentiment and speculative flows.
Market Sentiment,Trader perceptions can drive short-term currency movements.
Market Sentiment,Forex rates are heavily influenced by investor mood and expectations.
Relative Currency Strength,A currency’s performance is often judged relative to that of its major trading partners.
Relative Currency Strength,Exchange rates reflect how one currency performs against another.
Relative Currency Strength,The strength of a currency is often compared to its major peers.
Central Bank Intervention,Central banks can influence exchange rates by directly buying or selling currencies.
Central Bank Intervention,Monetary authorities can impact forex markets through direct actions.
Central Bank Intervention,A central bank might step in to stabilize a rapidly falling currency.
Commodity Prices,Fluctuations in global commodity prices can significantly impact export-driven currencies.
Commodity Prices,Changes in oil or metal prices can influence commodity-linked currencies.
Commodity Prices,Currencies of resource-rich nations often track global commodity trends.
